{
  "schema_version": "run_manifest.calibration.v1",
  "run_id": "run-012-schema-check",
  "status": "completed",
  "human_gate": false,
  "outputs": {
    "report_ref": "01_os/_runs/run-012/report.md",
    "artifact_refs": [
      "01_os/_runs/run-012/result.json"
    ]
  },
  "checks": [
    {
      "id": "SCHEMA-01",
      "required_pass": true,
      "tags": [
        "structure",
        "local"
      ]
    }
  ]
}
